<?xml version="1.1" encoding="UTF-8"?>

<b:bookshop xmlns:b="http://www.bookshop.com"
	xmlns:xsi="http://www.w3.org/2001/XMLSchema-instance"
	xsi:schemaLocation="http://www.bookshop.com model.xsd">

    <departmentScientific type="scientific">
    
        <books type="scientific">
    
            <book type="scientific" title="Master Thesis" ISBN="978-1-2345-6789-7">
                <year> 2016 </year>
                
                <authors>
                    <author> "Simon Picard" </author>
                    <author> "Marc Alfred" </author>
                </authors>
                <publisher> "ULB" </publisher>
                <abstract> "Un mémoire..." </abstract>
                <edition> "Edition numéro 1" </edition>
            </book>
            
            
            <book type="scientific" title="Master Thesis" ISBN="978-1-2345-6789-7">
                <year> 2016 </year>
                
                <authors>
                    <author> "Simon Picard" </author>
                    <author> "Marc Alfred" </author>
                </authors>
                <publisher> "ULB" </publisher>
                <abstract> "Un mémoire..." </abstract>
                <edition> "Edition numéro 1" </edition>
            </book>
        
        </books>
        
        <journals>
        
            <journal title="xcd">
                <year>1995 </year>
                <editors>
                    <editor>"Gallimard"</editor>
                </editors>
                <volume>3 </volume>
                <number>1 </number>
                <publisher>"La maison de la plume"</publisher>
                <impact-factor>
                    <value>6 </value>
                    <year>1996 </year>
                </impact-factor>
                <articles>
                    <article title="un article">
                        <authors>
                            <author>"Jean Marsouin"</author>
                        </authors>
                        <start-page>1</start-page>
                        <end-page>8</end-page>
                    </article>
                    <article title="un deuxieme article">
                        <authors>
                            <author>"Paul Eustache"</author>
                        </authors>
                        <number>8 </number>
                    </article>
                </articles>
            </journal>
        
        </journals>
             
    </departmentScientific>

    <departmentLeisure type="leisure">
    
        <books type="leisure">
            <book type="leisure" title="Harry Potter" genre="sci/fi">
                <year>2001</year>
                <authors>
                    <author>"J K Rowlling"</author>
                </authors>
                <publisher>"Gallimard jeunesse" </publisher>
                <number-page>423</number-page>
                <edition>"deuxiemme edition"</edition>
            </book>
        </books>
        
        <periodicals>
            <periodical title="Science et vie junior">
                <publisher>"SCV publishing "</publisher>
                <price>8</price>
            </periodical>
        </periodicals>
        
    </departmentLeisure>

</b:bookshop>